QUESTION,REPONSE,DIFFICULTE
Quel événement a touché les côtes françaises en 1999/2000 (Marée noire) ?,Erika,3
Qui a chanté "Moi... Lolita" ?,Alizée,1
Quel film d'animation a pour héros Shrek ?,Shrek,1
Quelle console de jeu est sortie en 2005 chez Microsoft ?,Xbox 360,2
Qui a gagné le Tour de France 2000 (titre retiré) ?,Lance Armstrong,1
Quel film a pour héros un petit robot blanc (EVE) et jaune (WALL-E) ?,WALL-E,1
Qui a chanté "Boulevard of Broken Dreams" ?,Green Day,2
Quel pays a adopté l'Euro en 2008 (île) ?,Chypre (ou Malte),5
Quelle émission de télé-réalité enfermait des candidats dans un château ?,Star Academy,1